,id,title,author,created_utc,score,upvote_ratio,num_comments,selftext,comments
198,r5zggw,Bitcoin mining should not be a taxable event. Bitcoin profits from mining should only be taxed once they are actually used.,RandomRedditGuy322,1638311892.0,12,0.7,12,"So currently when you mine any kind of cryto currency, you need to pay taxes on it just as it was regular income.

But this doesn't make any sense.  As income requires realization of gain, and if bitcoins are sitting in a wallet unused then they haven't been realized yet by a taxpayer.  This would be the equivalent of taxing someone for $1000 in unrealized gain on stock appreciation, because the crypto in my wallet can depreciate and lose value just as the stock can lose value.

Paying taxes requires realization of gain, and until I actually go to use my mining profits I haven't gained anything.  So the IRS shouldn't be able to make me pay taxes on it.",<praw.models.comment_forest.CommentForest object at 0x0000017713168908>
199,r5xhcg,Misinformation is just another term for different opinions.,InnocentPerv93,1638306506.0,0,0.43,18,"So just to clarify, this is not meant as being antivax, as I’ve literally gotten the Covid vaccine and encourage anyone to get it.

However this whole push against “misinformation” and what people classify as misinformation is deeply disturbing and troubling. People seem to have lost the concept that it is okay for people to disagree, even when it is against things like science and such. It’s okay to disagree but this push to actively silence with impunity any opinion that goes against widely accepted science should not be encouraged or viewed as “the bare minimum” of what you should do. No, someone sharing their opposing opinion on the vaccine, or vaccines in general, or on what masks do, etc are not actively harming people if people listen to them. What happened to personal responsibility?",<praw.models.comment_forest.CommentForest object at 0x000001771317F320>
200,r5xb6r,"As an uncircumcised guy, I would literally rather die than be circumcised",Ilp771,1638306052.0,13,0.62,127,"I cannot possibly think of anything more horrific that's so common. It's *terrifying* that this could have happened to me if my parents so wished.

The fact that so many helpless infants are forced into this puts me in a state of utter despair.

Fuck the world.

No other modern-day human rights violation is comparable.",<praw.models.comment_forest.CommentForest object at 0x00000177130E7A90>
201,r5n3hi,At any age children are a direct reflection on their parents.,Believer109,1638278254.0,10,0.62,36,"So I think this is unpopular (I guess we'll see) because whenever I say it people tend to REEEEEEEEE about it and how bad parents can produce good kids/adults so it must not be true. I don't buy that for a second. When your kids are young their behavior is a direct reflection on your parenting skills. If they are loud, obnoxious, insolent little shits who speak without being spoken to by adults or act inappropriately in public that is and should be a reflection on the parents. I hardly ever blame the kid. I blame the parents. 

When children grow up into adolescence and teenage years their behavior is ALSO a reflection on their parenting. If they turn into a goth or something that's embarrassing for the parents, and it's likely due to some deficiency in their parenting skills. 

When children grow up and get jobs they are STILL direct reflections on their parents' ability to built an adult man or woman who is capable of supporting themselves and/or their families. If they grow up to be a welfare mooch or a Wendy's porter then that is a reflection on the job their parents did. 

Now, this doesn't absolve children from responsibility for their own life and decisions. Parents guide and teach their children and are very responsible for how they turn out, but the child should also see this fact and strive to improve themselves and make the most of themselves so as to reflect well upon their parents.",<praw.models.comment_forest.CommentForest object at 0x00000177130C00B8>
202,r5ktlz,[deleted by user],,1638269870.0,0,0.21,8,[removed],<praw.models.comment_forest.CommentForest object at 0x0000017713052438>
203,r5bvbe,"You don’t have mental health issues, you’re just lazy, shitty, toxic, etc",Throwaway12-34167,1638237820.0,0,0.45,17,,<praw.models.comment_forest.CommentForest object at 0x00000177130C7F98>
204,r593jx,Make Male Genital Mutilation (Circumcision) an offence unless medically required,,1638229569.0,12,0.63,11," 

# Make Male Genital Mutilation (Circumcision) an offence unless medically required   

I’m asking the UK Government to criminalise circumcision, no  exceptions for Religious circumstances, unless it has to be done for  medical reasons, such as an infection. Parents or medical professionals  found Circumcising children otherwise should be prosecuted accordingly.

More details 

The fact that FGM (Female Genital Mutilation) is criminalised but MGM isn’t is extremely sexist & wrong.   
 

MGM can have a profound effect on children’s mental health and it is often done without the child’s consent.   
 

I am asking that performing or allowing MGM to be performed be made a  specific criminal offence. Where a parent is involved the penalties  should include losing their child.

[https://petition.parliament.uk/petitions/598185](https://petition.parliament.uk/petitions/598185)",<praw.models.comment_forest.CommentForest object at 0x00000177130F85F8>
205,r50kvu,Feminism is the answer to men's custody concerns.,Scribbles_,1638206167.0,0,0.5,96,"Before you downvote, hear me out:

I am a gay man, but the custody issue touches on something that affects me too: that men are less likely to be seen as nurturing, good parents. 

Let me lay what I think are two core issues of this matter and how feminists address those problems.

---

**Problem:** Society's vision of men being seen as less nurturing (by comparison of society seeing women as nurturers)

**Feminist solution:** Dissociate nurturing from womanhood. By removing the expectation that women be nurturing, this social bias in rulings will be mitigated. Encouraging boys and men to embrace nurturing behaviors and creating a social environment where those behaviors are not seen as weak is definitely concordant with feminist views on the issue.


---

**Problem:** Women are more likely to be stay-at-home caregivers and to do most of the emotional labor of child rearing. When assessing the welfare of the child the parent who does most of the labor of child rearing usually gets custody, that happens to be women more often.
 
**Feminist solution:** Women enter the workforce more often and men become stay at home dads more often. The more a man engages in the physical and emotional labor of child rearing, the more likely he will be seen as a viable candidate for custody. By creating more situations where it is clear that the father performs many of the duties of child rearing it will make a stronger case for the father keeping custody of the child.

---

On top of the adequacy of these feminist solutions, I see a lot of men's rights spaces advocating a sort of traditional masculinity that at times eschews nurturing behaviors or sees staying at home to care for children as emasculating. And to those people, they can't exactly have it both ways to continue playing into a societal belief of men as emotionally distant providers and also believing that they should be granted custody of their children (who unquestionably need nurturing to develop into healthy adults).",<praw.models.comment_forest.CommentForest object at 0x0000017713108278>
206,r4yl47,Its my right is a dumb argument,WaterDemonPhoenix,1638200737.0,0,0.31,12,"Usually people misunderstand what s right means 

'I think gays are sinners'. Awesome stuff asshole. 'Its my right' Yeah cool, what's your point? 'You should stop criticizing me because its my right'. Nope. Still an assbole. 

Its my right to call you an asshole and its your right to tell me to shut up, doesn't mean I'm gonna.",<praw.models.comment_forest.CommentForest object at 0x000001771321AB38>
207,r4xq1f,"Whatabout arguments are bad, because even if someone focuses more on one group/issue more than the other one of the same category, it doesn't mean the points made about the focus group is wrong",donotholdyourbreath,1638198186.0,3,0.6,5,"It's unpopular because people don't realize that focusing on one group doesn't mean your points are incorrect. If I said 'men face violence, we need to address that' and your response is 'what about women' that's stupid. Is it true or not that men face violence?

If I said that the liberal party is filled with liars and then you say 'but what about the green party?' I mean, fuck them too, but it's irrelevant. I could have an unhealthy obsession, but the 'what aboutism doesn't address the heart of the issue'. The liberals are the ruling party right now, so of course I focus on them. Even if I said the flaws of the liberal party are bad but not in the green party, it is either true that Trudeau did some non politically correct stuff or he didn't, regardless if the green party leader did it too or not. 

Also, the common arguments with religion is so funny. It's either Christianity or Islam. If I criticize Islam it's 'what about christianity'. The funny thing is, people have no arguments after that if I say 'fuck em both. Neither has convincing evidence for a god'. If I criticize Christianity people assume that I'm ""a left wing who loves Islam"" The Quran has their bits, and the Bible has crazy bits. But whataboutism would derail conversations. Show me evidence that Mo really did fly to the moon. Just because Catholics can't prove that the wine really IS jesus's blood doesn't prove mo flew to the moon. Just because Muslims can't prove that djinns are really doesn't mean Jesus really resurrected and so on. It's nonsensical.

It's unpopular on reddit but if someone uses what about ism arguments I will tell them that they can either address my point as either true or not true or GTFO. It's unpopular on reddit cause people think if you don't answer their question you are wrong. I mean, whatever floats your boat, but I aint gonna engage with dumb fucks like that.",<praw.models.comment_forest.CommentForest object at 0x000001771323D978>
208,r4uhyv,"School should be optional in the USA because most kids don't want to be there, to learn, and make life a living hell for kids who do and their teachers...",,1638187827.0,0,0.45,17,"I feel so bad for teachers these days. You have some good kids who go to school to learn, take interest in the curriculum, pay attention, do their homework, do everything right. In contrast you have kids who don't want to be there, who start fights, distract the class, make teacher's job's hell. It makes no sense that these kids who don't want to learn anything are forced into going to school. Eventually they'll end up in jobs (big assumption they'll work I suppose) that doesn't even need the skills they learned. 

In the interest of teachers and kids who go to actually participate I think these sorts of students should not have to go to school. In fact I think schools or teachers should be able to ban them from their classroom/facilities.",<praw.models.comment_forest.CommentForest object at 0x00000177130E1FD0>
209,r4r245,[deleted by user],,1638173582.0,0,0.5,10,[removed],<praw.models.comment_forest.CommentForest object at 0x0000017713137470>
210,r4cxng,The “Patriarchy” does not exist anymore,puzzlehead989999,1638129696.0,21,0.69,35,"Let me just say I respect all women but their lack of accountability in the modern western world is astounding. First here's a fact 80 percent of women go for the top 20 percent of guys. Another fact is women aged 18-35 say they prefer a bad boy personality. Another fact is since tinder started gaining popularity in 2014 STD rates rose drastically from 2014 to 2017. Which mathematically only makes sense with something like an 80 to 20 rule. Another fact is despite over half of gen z women saying that men need to do better to stop women's depression and anxiety. Another fact is women consider 185cm+to be most attractive
Yet once again the studies prove that men suicide is far higher than women within that age range. Another fact is the biggest pay-for-service or content platform of the past 5 years only fans directly make good-looking women millionaires over around 2 months and it's mostly men who pay for these services. Given all of this evidence if anyone has an advantage it's Women.",<praw.models.comment_forest.CommentForest object at 0x00000177132AB1D0>
211,r4cdjf,This is exactly what I suspect you look like.,,1638128194.0,1,0.6,8,[removed],<praw.models.comment_forest.CommentForest object at 0x0000017713335400>
212,r47cou,All movies are cartoons.,Hikarirenamon,1638114910.0,2,0.58,17,"A picture is just a ""painting"", in the old days it was treated material that was reacting to being exposed to light with many mechanisms working together to prevent over exposure, in the modern era it is a program telling which pixel to be a certain color. Both are not real, it is like a fruit painting, the subject may be real but no matter how you try there is no way you can reach into the canvas and grab some grapes.

A movie is pictures being replaced rapidly at a high rate of speed, it is an illusion, there are no people behind the screen emoting or reacting. It is all false, not real, it is staged for the amusement of the audience.

In short, no matter how you cut it, movies are just cartoons.

Get over it.",<praw.models.comment_forest.CommentForest object at 0x000001771335F080>
213,r470e3,"Most people chose the occupation they have, so the outcomes isn't some sort of bias",WaterDemonPhoenix,1638113965.0,17,0.66,58,"Most people who are in low paid jobs, ie women dominated jobs, chose the jobs. (Childcare, teacher, etc) Complaining you get low pay as a woman is illogical. You aren't paid low because you are a woman, you are paid low because of the job, which you knew. 

Men saying how men are more often than not dying on the job, yeah that sucks, but it isn't a sexism thing. It's not shitty because we force them into it, it's shitty because they die. But no, often, neither women nor men are forced to be teachers or construction workers. 

In before, but what about poverty etc? Well, again, the 'force' is not gender related.",<praw.models.comment_forest.CommentForest object at 0x000001771336FB70>
214,r46xzc,Feminism is equality for some and this is not equality,Throwaway53765484,1638113775.0,11,0.62,72,"I had a discussion about this at work with a couple of female colleagues and they were not interested in listening to my opinion, so I thought I'd post it here to see what others think.

The definiton of feminism when searching on google is:

noun: **feminism**

1. the advocacy of women's rights on the ground of the equality of the sexes.

I stated that I did not think feminism reflected equality, they disagreed. Despite finding this definition we still did not agree.

They thought that the end part of the definition was the important part, ""on the ground of the equality of the sexes"" proving that equality was being sought after.

I thought that the first part was important ""the advocacy of women's rights"" and said that this does not represent equality as it is only for a chosen group. I see a contradiction in this. 

Can we advocate equality for some and not all and still call it equality?

What if there are issues that he chosen group is privilaged in, would it care to address these for the sake of equality? I doubt it and this would certainly not fit in with the definition of feminism that is given. 

What do you think?",<praw.models.comment_forest.CommentForest object at 0x00000177132BCD30>
215,r43m0s,Sex is a stupid addiction that people need to get over,GoodUsernamesSuck,1638103760.0,7,0.67,29,"Sex is only meant for reproduction. Having sex for fun is like eating when you're not really hungry. I've had sex for the last time 3 years ago and not focusing on it is great. Somehow, it turns out focusing on things that are either more productive or an easier way of having fun wastes less of my time and energy. Sure, sex feels good, but so do many other things that don't require as much compromise. 

Then you have the people who bring up the health benefits of having sex. Sure, it does have its benefits. The benefits of having sex for an hour are also easily outweighed by eating a Kit Kat or a hot dog the next minute. These benefits are minimal; you don't see people whose extreme health can be linked to sex. Plus, there are better ways to ensure your health that also don't depend on having to find someone who's down to do that with you first. Going for a walk is completely free. 

Unless you're in a relationship, finding partners to have sex with is mostly an expensive and tiresome thing. The effort-to-benefit ratio is extremely low. Most people won't last longer than 30 minutes (and if you do last longer than that, odds are one of you is getting sore and bored), so sex is really a crack addiction. People fiend for their 15 minute high. 

And as for people in relationships, sex is really just a shared addiction. It's what they do when they can't think of anything better to do. 

Masturbation is a healthier, safer way of getting sexual relief and I legitimately don't get why it's seen as something so bad by sex addicts. It's literally just solo sex. If you're one of these people who see sex as socially successful and masturbation as a loser thing, you're out your mind and completely self-absorbed. The difference is that masturbation is a personal thing that's not gonna bother anyone. 

Society is obsessed with sex. People are blinded by it because it's this pleasant thing that everyone is in favor of. It's like being told you can eat chocolate all you want. Addiction always gets out of hand when society says it's good. There's always that one article with often made up health benefits of sex telling people to just go and be indulgent. 

Take a good look around you and see how many people go crazy when they don't have sex for a week. If you think this is normal, you must be insane.",<praw.models.comment_forest.CommentForest object at 0x00000177132E4D30>
216,r3yxwu,These commercials with women trying to “manscape” men’s genitalia should be considered a hate crime against males,occasionaldrinker,1638085237.0,2,0.53,7,This is needed because it’s body shaming men for being natural and it’s extremely anti gay for assuming men would want to do something for a women’s benefits as if gay men somehow does not exist. I feel threatened every time I see these commercials on YouTube.,<praw.models.comment_forest.CommentForest object at 0x0000017713313A58>
217,r3qm0k,[deleted by user],,1638057723.0,0,0.36,42,[removed],<praw.models.comment_forest.CommentForest object at 0x0000017713653F98>
218,r3oe1s,I would rather Americans speak Spanish rather than English.,OddGuidance907,1638051302.0,0,0.43,14,"Spanish is easier to learn for non-native speakers, due to its grammar, pronunciation and spelling being very logical, consistent and simple.

English is a very difficult language to learn by all standards. 

The majority of countries in the Americas speak Spanish, and a common language with our southern neighbors would bridge cultural divides. Spanish was also spoken in the US before English was.",<praw.models.comment_forest.CommentForest object at 0x00000177132BABE0>
219,r3mr10,"Procedures should not be canceled because of anti-vaxxers filling up the ICU, the antivaxxers should just be denied admission if the ICU is full",Cookiemonster4394,1638046592.0,0,0.4,57,"I am referring to countries (like mine, Canada), where procedures are still being delayed and ""non-essential"" treatment is being delayed. Everyone thinks non-essential means boob jobs (but actually those seem to be progressing just fine), but it actually means anything where you're not gonna be dying of it right away.

Think of it like the trolley problem. Person A is tied down by cancer on one track and on the other track is person B. Person B is refusing to move off the track even though they can see the train coming and they think it's their right to get off the track. Who do you point the trolley toward? People say ""everyone deserves healthcare"" but removing the trolley is not one of the listed options and is a cheap way to get out of the argument. The choices are person A or person B, and we have prioritized person B for long enough.",<praw.models.comment_forest.CommentForest object at 0x00000177133DC518>
220,r3kx2e,"The ""If someone told you to jump off a cliff, would you?"" question makes sense.",MyRealAccount65,1638041395.0,4,0.62,15,"When you say ""I threw a paper ball across the room because my friend told me to do it."" You're implying that you're not capable of making decisions for yourself and that you blindly follow suggestions made by those around you, and also that you should be immune to consequence (such as detention) because it wasn't your idea to do it.

So when you then turn around and go ""Obviously I wouldn't jump off a cliff, that's stupid."" You're admitting that you can think for yourself and therefore determined that throwing a paper ball across the room was a good idea to act upon.

Not to mention, it's lame to try to pass the blame onto your friend because they didn't force you to do it. If you did successfully land the paper ball into the bin (and the teacher didn't see), you would take all the credit for yourself.",<praw.models.comment_forest.CommentForest object at 0x00000177133F4C50>
221,r3af9t,White people need to stop bitching about affirmative action,,1638007001.0,0,0.39,84,"Stop being racist. Affirmative action is correcting a wrong. If you think it's unfair, then you are essentially a racist white privilege denier.",<praw.models.comment_forest.CommentForest object at 0x0000017713470048>
222,r32qiv,Recent events were wonderful for us neurodiverse (Will automod let me post this post this time?),ChristianHumanBeing,1637979091.0,2,0.56,16,"Censored to evade annoying bot. It took me like a dozen tries.

A certain recent event involving social isolating has actually been a blessing to those of us on the spectrum. It truly was satisfying to watch others suffer with the same social isolation it has forced many of us into for years prior. Also, mental ""stuff"" awareness has increased since more people who previously didn't have mental health issues now have mental stuff going on (I even had to censor that? Really?!). It's almost like not only were we more prepared than the rest of society, but we basically became more accepted by it while having the last laugh. That's what y'all get for socially leaving us out because y'all were ""cool"" kids back in high school. Meanwhile, due to more mental health awareness, us people on the spectrum along with other neurodiverse people have basically just blended into the rest of society and I finally found out what it feels like to be a part of it.

On a side note, now that society no longer really cares about us being on the spectrum and therefore I got to participate in it, lemme tell you something... the mainstream American discrimination is real. Getting accepted into ""European American"" America has really taught me a lot about how people with privilege don't give a darn about the oppressed here in the USA. Yet, these are the people I'm stuck with now despite often disagreeing with them for very obvious reasons. Oh well... still better than the constant isolation of old I guess.",<praw.models.comment_forest.CommentForest object at 0x0000017713410B00>
223,r324mn,A collection of my unpopular opinions,AntiPopulistNeocon,1637977176.0,0,0.43,31,"* **Iraq War was justified, a good thing, and a success in the long term.** The purpose of the the Iraq War was to remove regimes hostile to the United States because hostile regimes might harbour terrorists sites in the future.

* **I like politicians and Congress.** I think they are typically smart, hard working, good-hearted people trying to help make America a better place.

* **Jeffrey Epstein *did* kill himself.** The world focusing on him, he was facing a long prison sentence, he was used to a life of luxury and now was in solitaire confinement, all for crimes which would have led to a small prison sentence for anyone that wasn't him. Who in that position wouldn't kill themselves?

* **I hate Europe because it is a third-world communist shithole with horrible policies.** Europeans are so insufferable online. Going to a major European city is like going to a small shitty town in America. Terrible run down and ugly buildings. No food and other delivery services. Horrible taxation policies. Somehow they have lots of racism and open-borders policies at the same time.

* **America is the greatest nation in the history of the world.** No nation has had more freedom (think 1st and 2nd amendment). And no nation has brought so much peace and stability worldwide in human history. Without America the world would probably be stuck in the 1950s right now.",<praw.models.comment_forest.CommentForest object at 0x000001771348BC50>
