,id,title,author,created_utc,score,upvote_ratio,num_comments,selftext,comments
61,rlqypc,"It’s pathetic how on every sad video’s comment section, everyone is bragging about how they’re crying.",TransGoTa,1640128777.0,1,0.53,5,"I swear to God, this is a new thing. It’s a new generational thing. There used to be a time where we didn’t put our weaknesses on display. But, if you go on the comment section of any sad video, more than half the comments will be some variation of how the commenter is crying.

The comments will be:

“Well fuck, it’s morning and I’m already crying”

“Who’s chopping onions in here?”

“I’m walking on the street and my eyes are filled with tears”

“I’m crying so much”

WE FUCKING GET IT. YOURE CRYING. WHAT THE FUCK DO YOU WANT, A TROPHY?


Good God, it’s fucking pathetic. And furthermore I’m not saying that a video can’t be sad and you can’t express your empathy. You totally can, and in much more articulate and dignifying ways too. You can easily say, “goodness, I can’t begin to imagine the pain in this person’s heart. This is very sad” but no every fucking comment is “IM EATING STOUFFERS MAC AND CHEESE AND CRYING INTO IT”

And I’d be willing to bet that half of the people bragging about how crying are Millennial or Gen Z males. Don’t get me wrong, I’m sure a bunch of females are making those comments as well, but I’m just saying that these days, men tend to have no shame about that kind of thing too. There’s not even an attempt two hide emotions anymore. It’s all about letting them all out and it’s cringe worthy.",<praw.models.comment_forest.CommentForest object at 0x000001770C3A1C88>
62,rll0aa,[deleted by user],,1640111681.0,0,0.3,31,[removed],<praw.models.comment_forest.CommentForest object at 0x0000017709DD39B0>
63,rlkpbb,MLK would be labeled a racist by the woke right if he was alive today,lawandorder3,1640110817.0,8,0.61,67," 

“Why is equality so assiduously avoided? Why does white America delude itself, and how does it rationalize the evil it retains?

The  majority of white Americans consider themselves sincerely committed to  justice for the Negro. They believe that American society is essentially  hospitable to fair play and to steady growth toward a middle-class  Utopia embodying racial harmony. But unfortunately this is a fantasy of  self-deception and comfortable vanity.”

—  Where Do We Go From Here, 1967

“I  contend that the cry of “Black Power” is, at bottom, a reaction to the  reluctance of white power to make the kind of changes necessary to make  justice a reality for the Negro. I think that we’ve got to see that a  riot is the language of the unheard. And, what is it that America has  failed to hear? It has failed to hear that the economic plight of the  Negro poor has worsened over the last few years.”

— Interview with Mike Wallace, 1966

“But  it is not enough for me to stand before you tonight and condemn riots.  It would be morally irresponsible for me to do that without, at the same  time, condemning the contingent, intolerable conditions that exist in  our society. These conditions are the things that cause individuals to  feel that they have no other alternative than to engage in violent  rebellions to get attention. And I must say tonight that a riot is the  language of the unheard. And what is it America has failed to hear?… It  has failed to hear that the promises of freedom and justice have not  been met. And it has failed to hear that large segments of white society  are more concerned about tranquility and the status quo than about  justice and humanity.”

—  The Other America, 1968

“The  problems of racial injustice and economic injustice cannot be solved  without a radical redistribution of political and economic power.”

— The Three Evils of Society, 1967

The  Woke-White-Right, Critical Post Racialism Theorists like to cherry pick  king to gaslight the modern MLK antiracism movements. King would roll  over in his grave if he knew that the moderate whites(a euphemism for  white racists) are exhibiting the same behavior they exhibited towards  him. White people hated king back then, just like they hate the modern  woke that continue his legacy. It goes to show you that the woke are  right after all, and the white moderates are doing what they've always  done.",<praw.models.comment_forest.CommentForest object at 0x000001770A4F3780>
64,rlkbgp,"As a meat eater, we lose the moral argument when it comes to comparing eating meat to be@stality",,1640109750.0,0,0.38,54,[deleted],<praw.models.comment_forest.CommentForest object at 0x000001770A73DF60>
65,rlk939,[deleted by user],,1640109579.0,1,0.56,6,[removed],<praw.models.comment_forest.CommentForest object at 0x000001770C29C080>
66,rlcr9l,BDSM is a politically correct term for rape and bdsm fans are just as dangerous to society as Trump supporters and pit bull apologists,occasionaldrinker,1640086239.0,0,0.31,12,[removed],<praw.models.comment_forest.CommentForest object at 0x000001770FD6FE48>
67,rkwp38,[deleted by user],,1640033067.0,6,0.55,83,[removed],<praw.models.comment_forest.CommentForest object at 0x000001770FD94EB8>
68,rkutf9,[deleted by user],,1640027870.0,0,0.5,16,[removed],<praw.models.comment_forest.CommentForest object at 0x000001770FD88B38>
69,rkghij,"Putting yourself in the box of the left, the right or conservative or liberal is dumb since they are impractical words",WaterDemonPhoenix,1639981104.0,13,0.67,18,"The problem with (most) people who put themselves in the box of the left or the right or whatever is that their boxes are too black and white while their actions and beliefs are not. 

Let's take the example of some trump supporter who claims to want small government and calls themselves conservative. They claim the government shouldn't be big all the while support large militaries. For the record, I'm not against big militaries, I just don't find it useful to call myself right wing. Why should I? I can talk about my stances without needing to say I'm right wing. Because saying I'm right wing doesn't explain my views. I can't explain my views with just 'I'm a conservative'

Before you jump in because you have a political science degree, its possible that in academia these words are well defined. However, I think we should purge it from colloquial terms. No one has been able to give a definition of liberal that everyone or at least 95% can agree on. 

also, to assume one is say, a liberal because they believe in x, and therefore because they are a liberal they believe in y is stupid. I admit there is a correlation with x and y, but to make it definite is the problem. 

Finally, to claim that there is this entity that is the right is dumb. 'The right wants to kill education'. What group is this? Can you quantify them? No. 

Like its just stupid if I say I think sex work should be legal I'm a dirty leftist feminist, but then when I say we should have fewer refugees being accepted I'm now a right wing Nazi. Well am I left wing or right? 

You can argue my views on sexuality is on the left, whatever that means, and my views about refugees are on the right, and while that might be useful, the problem is we focus on the person. If one has a left leaning view then a right leaning view, do they cancel out? 

It goes without saying placing yourself on the left or on the right leads to tribalism. You create this bogey monster and claim anyone criticizing you is on the left and to be defeated. (Or right)",<praw.models.comment_forest.CommentForest object at 0x000001770FD7B400>
70,rk4gir,"Education can be free up to highschool, but I think making it free for anything higher isn't a good thing",WaterDemonPhoenix,1639944142.0,2,0.54,16,"Its unpopular because people all over the country seem to be leaning towards wanting college to be free. I can get behind highschool being free since everyone follows the same curriculum. The problem with college is that everyone specializes in their own thing. I think we should let the market decide what is more valuable. If you make it free then we are spending money on sy, women's studies that is not in demand. This means tax payers are paying money for degrees that don't necessarily give results. 

I think its unpopular on Reddit because people seem to have this idea that letting the market decide things is bad. 

I think if you flunk and the state pays for your education, its a bad investment. Yes, education helps people be economic contributes, but its a risk, especially for larger countries.",<praw.models.comment_forest.CommentForest object at 0x000001770FD2ED30>
71,rk3yy6,You shouldn’t have a choice on whether your organs are donated after death.,ffffuuuuuccccckkkk,1639942712.0,0,0.48,33,"Tdlr: if your organs are healthy they should be donated after you die there’s no reason why they shouldn’t. 

Unless it goes against your religion or your families religion somehow I guess. 

 But other than that I find it pretty selfish if someone is against donating their organs or their family members organs (not their entire body just their organs). Like seriously there are people dying because they’re in such an unfortunate position in life that they never asked for. And you want to take your after-death healthy organs with you to the grave? For what? You want your healthy organs to be cremated after death? For what?? It makes no difference on your death or what happens to you after death. Even if you have an open casket funeral… people attending your funeral aren’t gonna open your dead body up and be mad you're missing a kidney or some shit. You could save a persons life so their family doesn’t have to go through what your friends and family will have to go through.",<praw.models.comment_forest.CommentForest object at 0x000001770FDAA710>
72,rk2x48,"College shouldn't be free. I'm not talking about how ""Oh it isn't free because taxes"".",,1639939579.0,10,0.63,26,"I mean college shouldn't be free because it's not mandatory. If it was mandatory that everyone in the country went to college, it would be asinine to make them pay for it, right? College isn't mandatory though, so why should we force people to give their taxes to an education program that runs more like a business than school? If college was mandatory, as in, everybody in the country was \*forced\* to go to college like they are K-12, then to make it a paid education would be stupid and heavily fought against. However, it isn't, so there's no need to make it a tax-provided service.",<praw.models.comment_forest.CommentForest object at 0x0000017710E00A58>
73,rk2exb,Dog owners are completely incentive,occasionaldrinker,1639938075.0,12,0.67,26,"I have personal issues that make it extremely uncomfortable to be around dogs. I don’t like dogs and don’t want them around me. No I do not abuse or hurt dogs.

However my entire life has been filled with seeing dog owners letting dogs off a leash, dogs running up to me and jumping on me and if I complain about it the owners always say “my dog won’t hurt you”. Never mind the fact it’s a terrifying experience for me to have dogs jump on me or be around me off leash.",<praw.models.comment_forest.CommentForest object at 0x0000017710E0C780>
74,rk2amw,Newborn babies aren't people,alexmijowastaken,1639937714.0,0,0.43,68,"A newborn isn't really any more intelligent, conscious or self aware than a dog or pig is, so they shouldn't really be counted as people (not to say that they should have no rights, but rather that they should have something more like animal rights). I'm not sure exactly when a baby becomes a person, and it's certainly a gradual process that likely happens at different times for different people, but I'd guess it's somewhere between 6 months and 3 years old.

I also think that the fact society disagrees with this so much is a really big problem in that it means our conception of personhood is really messed up (and that'll be extremely important in the future when there are sentient AIs that should be getting ""human"" rights).",<praw.models.comment_forest.CommentForest object at 0x0000017710DA82E8>
75,rk0gzp,The right complaining about how crt/wokeness etc spreads division are cap,lawandorder3,1639932274.0,0,0.36,11,"Dude over there living in his white community, with a white spouse, who only has white friends, who specifically sends his kids to white schools, goes to white church, eating his White-o's with 100% fat white milk, while watching the very white Friends, talking about how he hates division lmao. 


How the modern white-woke Conservative uses ""Division"", is similar to people who say ""we need to have an honest conversation about race"". They don't want an honest conversation, they simply want you to capitulate to all of their talking points. What the white-wokes actually mean by ""Division"" is : ""you're trying to stop me from being racist, in turn, taking away all of my unearned white privileges. We as racists love our privilege and don't want that to change, therefore, you are necessarily wrong "". That's all it is, man. It really is that simple and is the foundation from which the white-woke Marxists operate. 


Nah, we've always been divided. Back then it was by force, today it is by choice. Jim Crow, Segregation, etc, was only possible because it's what white people wanted, which is why the same behavior is seen today, despite overturning forced segregation. Saying everything was just fine and dandy, until a couple of purple haired feminists on twitter came and mucked it all up, is white woke Marxist propaganda, easily refuted with basic history. That's because it's fundamentally about maintaining white hegemony.",<praw.models.comment_forest.CommentForest object at 0x000001770FD49F98>
76,rjrfz5,Infanticide is morally OK,alexmijowastaken,1639897998.0,1,0.67,8,[removed],<praw.models.comment_forest.CommentForest object at 0x0000017710DE69E8>
77,rjnech,Comparing CRT/Wokeness to the Chinese Cultural Revolution or 1984 is pure projection. All of the legislation that is censoring what teachers can talk about and what books can be available in schools is coming from the anti-CRT crowd.,Electrical-Ad-9797,1639883299.0,4,0.57,72,"These kinds of arguments have been made over and over to fuel the panic surrounding CRT but I challenge anyone to find a piece of legislation or proposed legislation to censor dissenting perspectives coming from the CRT side.  Getting “cancelled” on Twitter or private social media companies deciding what to allow is in no way comparable to actual laws that limit what teachers can and can’t talk about.  The “stop woke” bill in Florida is effectively no different from the Ministry of Truth in 1984.  The accusation is constantly thrown around that proponents of CRT try to silence their critics by calling them racists.  However I only see the opposite happening.  Multiple states are passing laws outlawing the teaching of any material related to CRT based on the accusation that it is “anti white racism”.  However that accusation is not fact but opinion.  Certainly it is the opinion of the Harvard School of Law where CRT was developed that it is not anti white racism but rather a critical analysis of the ways systemic racism is perpetuated and interacts with the law.  If the anti-CRT side feels so confident that their views concerning systemic racism are correct than why are they making opposing viewpoints illegal?  That makes it look like they know they are wrong and are threatened by the truth.  The whole point of education is to be exposed to diverse perspectives and form your own opinion using critical analysis.  I read “The Communist Manifesto” in high school history, that doesn’t mean I was being indoctrinated into Communism.  How can you expect students to be able to do this if you are outlawing and censoring all materials from perspectives you don’t agree with?  That sounds like actual indoctrination.",<praw.models.comment_forest.CommentForest object at 0x000001770FDB5198>
78,rjdcnu,It doesn’t matter if characters are race swapped,,1639851942.0,0,0.47,61,[deleted],<praw.models.comment_forest.CommentForest object at 0x0000017710E7E390>
79,rjbnuj,I am service worker but i support automation,Logical_Round_5935,1639846973.0,4,0.64,9,"Is it gonna put me out of a job? yes if I don't find other skills. However, for me, it's not a job I would wish on anyone else. I know people will say that some people might like their job. That might be true, but in my opinion, we are better off if service workers are replaced by machines. 

Most service workers are not necessary. A machine can full fill the roles too. There probably just needs a maintenance guy and the guy who answers questions that the software didn't account for. Then the customer service person just tells maintenance guy to add updates to the machines.

I know this sounds very dystopian, where shit like sci first stories where everyone is in pods, but I don't know, its an utopia for me. 

despite being service worker, some service workers annoy me. And sometimes customers annoy me. I personally think humans are not worth the stress to talk to. If we can reduce the number of human interactions, I would. And I think that is the unpopular part. People talk about how this day and age we are on our cell phones. Its true. yeah video games damage my eyes so that's something I'm trying to kick, however, even social media tires me.

Humans to me, are for the most part mean spirited.",<praw.models.comment_forest.CommentForest object at 0x0000017710EACCF8>
80,rjbgxu,"Rights do not come from any god or gods, or any supernatural source. They're agreements we make with others on how we want to be treated.",level20mallow,1639846429.0,3,0.6,10,"And that's all.

It's a descriptive statement, not a prescriptive one, and it's one we desperately need to accept if rights are to be restored. 

To be honest though, given the coronavirus pandemic and the fact that almost everyone willingly and blithely threw away not only their rights but the rights of everyone else just to buy themselves the illusion of safety, love and belonging, I don't think rights are even a good way to convince people not to mistreat or abuse others.

I think we all would be better off if we were just brutally honest with each other and just made compacts stating that we will not do or approve of certain things being done to each other, and accept that some people are going to do certain things we don't like, to be able to interact with each other and have it a civilization. Have a value system that's collectively agreed upon instead of rights which are nebulous and ultimately powerless in the face of the circumstances in which they are needed the most, or laws that are violently enforced by the state and cannot be realistically applied in all or even most circumstances and often go against the state's best interests to enforce.

We could hand out weapons to every human being to equalize the playing field and make those kinds of negotiations possible and necessary, so bullies can't use inherent power advantages whether they be violent or social to subjugate and abuse others.",<praw.models.comment_forest.CommentForest object at 0x0000017710E855C0>
81,rjb1n6,"Samsung sucks compared to Motorola, and I'm probably never going back to Samsung, Ever, due to no 3.5mm jack and Ads in stock apps.",D4NC3M461CD4NC3,1639845174.0,8,0.67,6,"So, recently I got a new phone. I was skeptical as it wasn't a big name flagship in the phone industry, but it has the features I was looking for. One of these is a 3.5mm headphone jack. I believe wired headphones or earbuds are far superior and safer than anything exclusively wireless or Bluetooth. That's just my opinion, consistent with my functional usage needs. 

The type of phone doesn't matter as much as the elements of it that I use and need such as the headphone jack and the fact that it is customizable, but I'll say it anyway. It's a Moto Stylus 5G 2021. For example, it does not have ads in native apps such as the music app like Samsung started doing. 

This phone did not even come with a native Gallery app so I was able to choose whatever app I decided. Some people would say that is left of a feature and more of a nuisance, but I disagree. I am all about user customization and more particularly, user freedom.

I feel it's unfair to compare my previous Samsung with this phone's features much further in this post as the earlier Samsung was supposedly factory unlocked but it was still Samsung which means the firmware and stock apps were had Samsung's wet blanket of control over them, while this new phone is a carrier phone. So, apples to oranges in those areas which I'll avoid when possible.

For me, ditching Samsung for the less ""popular"" brand Motorola has been the right decision due to my disagreement with Samsung's decisions.
These decisions are:

- To be a follower (of Apple who removed their 3.5mm first) instead of a leader in the industry.

- Dictating heavy-handed decisions regarding users' needs and requests en masse (Ok Google, remember dark/black theme user requests in Android for YEARS?)

- Ethical questions regarding ads in stock aps (particularly the music app) - or, more
 specifically, any kind of subscription-based business model that is unnecessary and therefore greedy.

It seems all these decisions are faced companies which gain any type of industry domination (Looking at you, gaming companies) companies fail to recognize the ones who made them great in the first place - their customers.

I came across an article saying Samsung is going to stop putting ads in their stock apps. Great, but for me, it is too little too late as I have already moved on to a better company's product for good. Just because a big name is hugely popular does not mean the company makes the right decision for all users.

Also, I never noticed a premium ""flagship"" phone ""feature"" that didn't seem like a gimmick or unnecessary waste of money or time that actually enhanced the official day to day use of my phone. Curved screen and wireless charging to me, were more of a hassle or liability than they were worth.

Goodbye, Samsung.",<praw.models.comment_forest.CommentForest object at 0x0000017710E8EB38>
82,rj7y1o,I really don't care about vegan ideology,Yeisen,1639835589.0,142,0.68,470,"I'm honestly completely fine with cows being murdered. It's not like I'm just ""ignoring the cruel truth"" or something like that. 

Most vegans I know say something like ""no but you are only seeing what you're eating, and not who was murdered because of it"".

And I do. The truth is, I don't care. I would even kill the cow myself if it was necessary. All for those delicious cuts of meat.

Is it bad environmentally speaking? Yes, it really is. Do I care? No, not really. And I'm not going to say something like ""But we're screwed anyway so might as well not stop"", it's more like, I don't care",<praw.models.comment_forest.CommentForest object at 0x0000017710F3BDA0>
83,rj522u,Stop paying attention to news about imaginary invasion of Ukraine until Russia actually does it.,,1639824568.0,5,0.57,8,[deleted],<praw.models.comment_forest.CommentForest object at 0x0000017710E8EA58>
84,rj43zh,Nothing feels better than wetting the bed in a cold night.,Snoo68113,1639820522.0,0,0.45,6,But the trick is you should be doing it in your sleep without actually wanting to do it. So it should awake you. It's such a comfortable feeling. Well the uncomfortable part is then you should get up and change the sheets but aside from that I think it is the greatest feeling.,<praw.models.comment_forest.CommentForest object at 0x0000017710E61358>
85,rj10u1,"If Men Believe Inequality, They Would Pay More Taxes Than Women",deathbypepe,1639807717.0,0,0.27,12,"Men are at a stage were we criticize Women for wanting equality, but not wanting to put in equal effort.

So as a thought experiment if we do collectively agree that Women are not Equal to Men then what happens when we apply that to taxes?

Well, if equality is paying the same amount of taxes for both sexes, then inequality is paying different amounts in taxes for the sexes.

&#x200B;

Of course Women only pay taxes because the Rockefellers funded the Womens Rights Movement because they couldnt tax half the population, and this historical fact strongly influences the idea of my post here.",<praw.models.comment_forest.CommentForest object at 0x000001770FD575C0>
86,rinqmk,[deleted by user],,1639765993.0,0,0.48,21,[removed],<praw.models.comment_forest.CommentForest object at 0x000001770FD73BE0>
87,ri9uvw,It would be more accurate for me to say that I speak American than to say that I speak English,,1639718193.0,0,0.5,10,"I know people like to make fun and say this is ignorant since the language is called English. The thing is that The distinction between language and dialects is a political one, not a linguistic one. Saying that I speak English implies that I speak the same way as this [dude](https://www.youtube.com/watch?v=luuA6bEoQIE&ab_channel=MuhammadQasim), which I clearly dont. By saying that I speak American it more accurately describes my manner of speech than simply saying English does.",<praw.models.comment_forest.CommentForest object at 0x0000017710FD0160>
88,ri9s24,Santa is communist,2-happy-Vaginas,1639717930.0,0,0.41,8,[removed],<praw.models.comment_forest.CommentForest object at 0x0000017710FF4BA8>
