,id,title,author,created_utc,score,upvote_ratio,num_comments,selftext,comments
119,reawko,I do not believe humans have inherent value,ScrotchyMcDumpwaffle,1639263116.0,13,0.69,43,"This does not mean that I believe humans have no value, just that there is no value just from being a human. 

Picture this. 

You are a brand new, adult human released into the wild. How do you survive? You must gather resources by foraging or trading with other humans to get your food, water and shelter from the elements. Nature does not just give them to you, effort must be spent to obtain them. 

Expand this into the modern day. Most land/resources are owned by others, so in order to obtain the necessary resources to survive one must trade with others. What resource do you have to trade? Your labor. You must trade your time/effort to someone else for the resources needed to survival, again nature doesn't strictly hand them to you. 

What determines how much someone gives you for your labor? They answer is how much value they believe that you add to them. Therefore, how useful you are to another is directly proportional to the amount you paid for your work. 

'Woah man, not everything is strictly about economic transactions. Sometimes you add value to someone's life just by being there for them'

You know what? This is 100% true. But, it's not by your inherent value that they care about it, it's based on the time and effort you've put towards getting to know each other. Additionally, the caliber of each person will vary on how much this relationship pans out. For instance, you could be friends, close friends, with someone for decades, but they wouldn't let you sleep on their couch if you were suddenly homeless whereas other people would let you do it after only knowing you for a week or two. 

The next thing someone might ask is 'well what about children'? Well I ask you, do you really care about children starving in the world or are you just too empathic to look a child directly in front of you, in the eye, begging for food 'no'? I would bet it is the latter and not the former because how many of you are donating money/effort in ending hunger around the world right now? 

All human interactions have the following thought, whether it is direct/overt or subconscious: how does this action benefit me? Is this worth it? Will this person pay me back either monetarily or benefiting some other way from our relationship (such as not feeling lonely, receiving love, affection, gifts etc)? 

There is nothing wrong with this. It is how we evolved and it's how we can function healthily but this is reality and I'm tired of pretending it's not (wink)",<praw.models.comment_forest.CommentForest object at 0x00000177112D6080>
120,re1k6e,Racebending art isn't a big deal,,1639234972.0,3,0.58,15,"It's just an alternative way of seeing the character and doesn't change their canon race. I'm saying this going all ways so if you want to change a black character white I don't really care. It doesn't do anything because the character will not change and it's just fanart. Most people seem to flip out by whitewashing and blackwashing art, emphasis on art. If it was a live-action characters should be casted accordingly. But since it's a drawing, it doesn't matter.",<praw.models.comment_forest.CommentForest object at 0x0000017711384400>
121,rdrjdg,'Eat the rich' mentality is often illogical and hypocritical,silveryfeather208,1639196934.0,10,0.63,13,"I bet if you could have the money the rich have, you'd take it, and you wouldn't want to be parted with your money. I am not disputing that we should have a better system to ensure less people go without food, just not the way or amount people think of.

What is also illogical is statements such as 'it should be illegal to have billionaires in a world where people are starving.' I grew up poor. We almost got evicted because we almost couldn't pay the bills. But now we are ok. I still hold the 'eat the rich' mentalities is dumb. I am now a lower middle class, I am richer than I was before, but I am still nowhere 'rich'. I got like, maybe 50$ left over after everything every month? I have a 15$ netflix. I could technically give it up and get like a 60$ left over? But I see so many middle classers saying the rich should give up their luxuries because 'poor people exist'. I find it funny, they don't speak for me, but even if they did, would they be willing to give up their luxuries for ME? because, in my eyes, my 15$ luxury doesn't compare to their, say, middle class 500$ resort weekend get away.

Yes, someone will say this is the 'slippery slope fallacy', but it's not. Please tell me what line do you draw before the rich shouldn't have their money? It's nonsense. I don't think the 'rich people must give their money away' is good economics.

Until you are willing to give up all your luxuries, I don't think you should lecture others on giving up theirs. Tell me your line and why.

The unpopular part I guess is, people think me being poor means I would agree the 'rich' must give up their money or have a salary cap or some shit. To me, that's not the way to make the poor not poor. I agree with taxes to some degree, but people are making ridiculously high numbers, like if you make over a million you should be taxed 20%, that's too high in my opinion",<praw.models.comment_forest.CommentForest object at 0x000001771110BA20>
122,rdf3fu,Hospitals should have 2 lines priority for vaccinated and non priority for unvaccinated.,Andalib_Odulate,1639160894.0,0,0.35,17,"If someone is unvaccinated, they should have to wait until their is no more vaccinated individuals who need a space in the hospital before they get an available spot.

It's not just about covid19 its about everyone else who needs treatment who can't get it because they are filled with unvaccinated idiots who decide that they want science to save them only after they get close to death.

Minor illness that could have been prevented by early detection  becomes major, major illness like cancer because deadlier because people aren't able to get check ups.",<praw.models.comment_forest.CommentForest object at 0x000001771146C240>
123,rd92vc,[deleted by user],,1639144226.0,0,0.36,24,[removed],<praw.models.comment_forest.CommentForest object at 0x00000177114596A0>
124,rcui23,I support child labor,HeadTea9880,1639093123.0,0,0.49,43,[removed],<praw.models.comment_forest.CommentForest object at 0x00000177114E2CF8>
125,rcnn3g,[deleted by user],,1639074008.0,0,0.29,8,[removed],<praw.models.comment_forest.CommentForest object at 0x00000177113D1240>
126,rcnlxs,[deleted by user],,1639073921.0,0,0.49,54,[removed],<praw.models.comment_forest.CommentForest object at 0x00000177115A47B8>
127,rcmbog,"Beyond a number of circumstances, theft and robbery are very much wrong and should be treated as such.",Mammoth_Western_2381,1639070341.0,4,0.61,19,"There are a few cases where stealing is understandable/""forgivable"". Namely people who steal food to eat or people who otherwise live under extreme poverty, as there is no point trying to criminalize survival instinct. Another case is petty theft, where the thief should just be forced to give back whatever they stole and maybe an extra fee for their troubles.

However IMO anything futher or other than that should be treated as a crime. Robbery is just inexcusable. No hardship can justify you threatening or hurting (often with a deadly weapon at hand) someone over their rightful belongings. And I see no justification for stealing from others beyond the cases I mentioned before.

Common counter-arguments I hear (speacially on Reddit) it's that: It's acceptable to steal from the rich, It´s ok to steal from Corporations and It's ok to steal insured property. All, IMO, are BS:

\- It's acceptable to steal from the rich: The rich are just as entitled to the protection of the law as you are. The victim being rich and the criminal being poor should mean nothing. Would it be ok to a poor man r\*pe a rich woman, or poor mass-murderer to shoot up a place full rich people ? Most reasonable people would say ***no***.

\-it´s ok to steal from Corporations: Same as the first. It's okay to blow up an Amazon facility or set a KFC ablaze because they are Big Money ? Besides, if you rob an amazon warehouse, you will not be pointing your gun at Jeff Bezos, you will be doing that to a minimum-wage bathroom-less employee. And that's not getting into the macro-effects of widespread stealing from business, such as they pulling out operations.

\-It's ok to steal insured property: Even if we assume all stolen property are insured, which is simply not true, you would still be severely inconveniencing someone else.",<praw.models.comment_forest.CommentForest object at 0x00000177115AD550>
128,rc8kzc,[deleted by user],,1639020633.0,0,0.47,46,[removed],<praw.models.comment_forest.CommentForest object at 0x00000177115C1358>
129,rc6qb7,Downvote this post,,1639014714.0,0,0.43,6,[deleted],<praw.models.comment_forest.CommentForest object at 0x00000177115BB3C8>
130,rc6ppq,I think men should always put the seat down.,fartssmellgreat,1639014662.0,6,0.6,50,"As a man, I think every man should wipe the rim of piss droplets and put the seat down when they piss, even if there are no women around. If not, at least aspire to. We all have to sit down to use the toilet sometimes, and nobody should have to look at your dried piss drops right next to where their bare skin goes.  
  
Plus, women shouldn’t have to suffer just because we were equipped with piss hoses. It’s our responsibility, not theirs. At least we don’t have to deal with our dicks bleeding 3 days a month, I’d say we got off pretty light.  
  
Side note: Any truly civilized man ought to push their gooch and dab any piss droplets off of their dick head when they have the chance to do so.",<praw.models.comment_forest.CommentForest object at 0x000001771148A160>
131,rc3hk2,Looking for Moderators,TovMod,1639004772.0,0,0.48,38,[removed],<praw.models.comment_forest.CommentForest object at 0x00000177115818D0>
132,rbzofv,"On their own, 99% of humans when evaluated superficially are neither ugly nor pretty.",silveryfeather208,1638993840.0,3,0.6,8,"Any time I see a YouTube channel and people are like 'oh my gosh, you so pretty'. or when people simp for celebrities. I truly don't get it. I have never had this feeling except maybe once. But beyond that, simply looking at a face doesn't really disgust me, nor does it please me. Maybe I have an extremely high and low standard, I don't know. The only ugly faces are mostly ugly because of mean behaviours that morph into psychotic emotions like anger. people who are diseases aren't ugly. I feel sorry for them but seeing people after going through cancer treatments isn't 'ugly' to me. 

Like I've felt my heart quicken over a crush which developed only after I saw him behaving in a pleasing manner. And he was someone the class made fun of for being ugly. I never saw it. 

I know my feelings are different from most people, but I think I've done a lot of dirty things like being a washroom cleaner, caring for kids that poop, seeing humans at their worse at a shelter that to me the behaviour is more important in evoking some emotion for me.",<praw.models.comment_forest.CommentForest object at 0x00000177115CEEB8>
133,rbsk0c,"I am a Myanmar citizen living in Yangon, Myanmar",Pupulay,1638973772.0,0,0.44,13,"I am a Myanmar citizen living in Yangon, Myanmar, and I must speak up again. I, alonhg with many other Burmese like me,, have been living with fear and ridicules daily for our beliefs system by PDF, NUG, CRPH, NLD supporters, for our unwillingness to support their vigilantist causes. I along with many others who were born and bred in Myanmar(Burma) and  do love our country.  However, we believe that acting in vigilantist manner is not the way to bring peace towards our country. We do not condone 

the murdering of the elder monks, 

kidnappings of the monks, 

setting up and throwing homemade bombs to schools, 

killing teachers because they're just going to attend school to teach

threatening parents with their childrens' lives and limbs, just  to not send their children to schools

causing daily bomb threats and causing explosions at the morning markets where we go to buy groceries.

A homemade bombs exploded twice on a same morning at the same market hat caused  serious injuries to two elder monks who were walking by.

A doctor who was handing out masks during our third wave of covid19 got gunned down in the middle of the street.

Yesterday a 5 year old girl died because she couldn't run when a vigilant threw a homemade bomb into the betel nut shop her parents opened in front of their home. 

Now a very elder monk who has just recovered from minor stroke, was returning back to his monastery and both the driver and the elder monk is missing.  

The missing was the last straw for me. That's why I am speaking out. Not all the citizens of this good country of mine are PDF supporters. We are normal people. Normal citizens. We are not politically motivated nor interested in the power struggle, but want to live our lives decently with what we could. Without fearing for our lives by these vigilant moments. It's just getting too much. 

\#Myanmar #Tootired #NomorevigilantisminMyanmar",<praw.models.comment_forest.CommentForest object at 0x0000017711618FD0>
134,rbrhjy,"Identifying as ""X-American"" is both valid and often good.",Kasunex,1638970499.0,1,0.55,8,"So the majority of pushback I see on identifying as ""x-American"" comes from people who fundamentally misunderstand it, mostly due to some bad apples. I'll just say it upfront: identifying as ""x-American"" is not the same as identifying as x. Being x-American doesn't make you a spokesperson for x. I agree that the people who do that are very disrespectful, but that's not what this is. 

Identifying as ""x""-American simply means that you have significant ancestry in said country, and try to both partake in and celebrate the culture you share with the descendents of other immigrants from said country. That's it. 

Take Irish-Americans, for example. We've got our own history of our ancestors coming over from the famine in Ireland to climb out of poverty in the face of anti-Catholic discrimination. Is that story American? Yes. But that's not something that people with ancestry in the Mayflower or Japan can claim as their own, despite them also being as  American as I. But it doesn't stop there! We've got our own heroes, like the Irish Brigade of the Civil War. We have our own movies like ""Gangs of New York"" or ""Boondock Saints"". We have our own music, like the Dropkick Murphys. 

Are all these things American? Yes, absolutely. But in the same way that nobody would question that something like ""The Boondocks"" is both fully American and distinctly African-American, one should be able to understand the same of Irish-Americans. And it's the same with Italian-Americans, Greek-Americans, or what have you. 

Why is this something important to Americans? Because we all grow up learning about how our ancestors came from somewhere else. Whereas people in other (non-former colonial) countries can figure their ancestors probably lived in the same general area for centuries, Americans know their ancestors have only been American for max a few centuries - and in many cases not that much. So, we Americans naturally want to know which story our ancestors come from. It's melting pot culture. 

It's important, too. Historically, much of the absolute worst of racism has come from groups who try to assert themselves as ""true Americans"". That's where you get shameful histories like the KKK of the 1920's. It's telling that today's KKK portrays ""whites"" as true Americans. The concept of race is a completely artificial way of grouping people with little to nothing in common past their skin tone, but it's used to justify hate. 

Reminding people of their immigrant roots encourages them to distance themselves from identifying themselves as ""true, white Americans"" and excluding immigrants. That's probably why (anecdotally) I've noted that first generation immigrants seem to be the most enthusiastic about identifying other Americans with their ancestry. It makes sense.  It makes them feel less out of place.

Tl;dr every American traces back from an immigrant group and identifying with that group is both justified and and an important part of being American.",<praw.models.comment_forest.CommentForest object at 0x00000177115E4470>
135,rbphof,"If there's a gay side of pornhub it's only fair that there's a lesbian side too, or add lesbian porn to the gay side lol",shawsexredemption,1638963613.0,2,0.54,11,"
I'm a guy, but the more female friends I make the more I realise this. Women watch porn, most of my female friends do and having a whole gay side but only categories for lesbians seems kinda stupid, you know?

Before you bite me, another reason is bc I feel like having a lesbian side would make it easier for people who wanna jerk off to it to access a bigger variety, and lesbians/mspec women get better have access to lesbian porn, too. Boom, everyone's happy. You have way more access to kinkier shit and tons of new categories and women get to see women screw other women easier so basically it's a win win.

Women using sex toys should also be there if a guy solo jerking off is considered gay. Which by the way it shouldn't sometimes people like the company, another hill I will proudly die on

Don't really know what I'm on about but I'm 100% sure I'm correct. Nobody can change my mind.

There should either be no gay side, or a lesbian side for women who want to get off to women and men who want to get off to women. It's unfair that there isn't, and we all know girls like porn too. Why is it different for women? Even porn hub acknowledges that women watch porn with that category of videos women favour. Being a woman is also an option when you make an account.

I will die on this hill. Make a lesbian side/add it to the gay side or merge the gay side and the straight side. It's only fair

Also unpopularopinions is full of pussies, took it down cause I mentioned the lgbtq even though I'm advocating for it smh",<praw.models.comment_forest.CommentForest object at 0x00000177115DE390>
136,rbmsb6,Reddit is arguably the worst app you can install.,undetectedwolverine,1638952700.0,12,0.64,21,"That's because if the many reasons that I will continue to list :

1-Atheism in reddit is so toxic to a level you can't imagine, there was a video of a guy who was holding a goat that was screaming out of nowhere and people started calling him slurs in the comments and bring islam into the equation somehow.

2- Reddit is full of wanna be intellectuals that are into the reddit hivemind , they downvote whenever they see a different opinion. It's basically that all opinions are welcome except the ones they don't agree with.


3- power tripping isn't uncommon among reddit mods, they can ban you for anything that other people do just because it breaks the rule 175 that they recently added. In reality, they don't have anything against you but they just ban you because of different opinions.

4- It's full of creeps, a lot of people here claim to love women and fight for their rights but then they go send  creepy messages to women. Not to mention the teenager sub, no one can comment or post there without having neckbeards in their dms.

5- You can't search anything on reddit without seeing anything NSFW even if you turn off the NSFW, that's because a lot of the porn isn't labeled as NSFW.

6- Subreddits like ahs and female dating strategy are there and they want to ban everyone but they have no chance of getting banned themselves.

7- A lot of redditors are obsessed with religious women in a very creepy and perverted way, they consider them oppressed if they don't want to show their bodies. Just post a photo from the 60s or 70s from a muslim country and this is the easy way to get karma, they don't mind that most women there were illiterate at the time. All they mind is them wearing miniskirts.

8- There are multiple subreddits which contain photoshopped photos of women on nudes, the women don't even know that someone did that to their photos.

There are more reasons than this but these are just the top ones.",<praw.models.comment_forest.CommentForest object at 0x000001771129D588>
137,rbh8ks,[deleted by user],,1638933384.0,0,0.46,15,[removed],<praw.models.comment_forest.CommentForest object at 0x00000177112AB7B8>
138,rbg2x8,The only reason the unvaccinated aren't prisoners in their own homes right now is because of the 2nd amendment,TriggurWarning,1638930000.0,29,0.61,169,"We will never give up our guns now because of the highly immoral policies cropping up around the world.  You can only treat defenseless people like this.  Never mind the fact the vaccine is [40 TIMES LESS EFFECTIVE](https://news.sky.com/story/covid-19-first-lab-tests-on-omicron-in-south-africa-suggest-pfizer-vaccine-may-be-up-to-40-times-less-effective-against-new-variant-12489417) versus the new Omicron strain.  Nah, because... fuck these people, am I right?

These policies are entirely imbalanced and lack basic common sense.  They're just being needlessly punitive versus people exercising control over their own bodies.  Truly, do we need further evidence that leftist ideology is a mental disorder that inevitably slides towards totalitarianism and tyranny?  I don't think so.

Stay afraid of the people, forever!",<praw.models.comment_forest.CommentForest object at 0x0000017711651588>
139,rbdtcp,"I'm pro choice, but if abortion was illegal, you definitely have, 99% of the time, the power to not get pregnant if you don't want to.",WaterDemonPhoenix,1638923304.0,2,0.53,79,"If weed was illegal, even if I think it's a nonsense idea, you have the power to not smoke. Yes, abolition of alcohol didn't stop people from drinking, that doesn't mean they didn't have the power to not drink. And while I understand their cause to make it legal, that doesn't mean they didn't have the power to not drink. Their arrest was their own doing. 

I believe in protesting and fighting, but I think if you are going to make the claim that getting an abortion is the way to fight anti abortion laws, I don't buy it.",<praw.models.comment_forest.CommentForest object at 0x000001771167ADD8>
140,rbcenl,I do not care about income inequality.,InnocentPerv93,1638919171.0,22,0.69,25,"Just some context, I live in the US. I make about 30k a year or so. I focus on finding ways to better my life. At no point while doing so have I ever heard of someone making much more than me, like MUCH richer than me, and thought “they have more money than me, fuck them!”.
It just sounds so hypocritical to me.",<praw.models.comment_forest.CommentForest object at 0x0000017711680F28>
141,rbappx,It is hypocritical to criticize people for raping their dog if you are not a vegan,JesusHandHoleFucker,1638914498.0,0,0.45,68,[removed],<praw.models.comment_forest.CommentForest object at 0x0000017711427240>
142,rbao4p,Japan wasn't the bad guy,JuliusBranson,1638914400.0,0,0.46,58,"Pearl harbor was an attack on a military base of a country that was effectively waging war on Japan via a massive oil embargo that was destroying their nation's economy.

If Japan had been successful in establishing peace in the East, there would be no Communist China or North Korea.

And furthermore let's not forget the treatment of Japanese immigrants in the US -- they were placed in concentration camps due solely to their heritage for the entirety of the war, something which is frequently left out of US text books. If the US had been sieged like Germany, over one hundred thousand Japanese probably would have perished like the Jews in the starving German camps.

Last but not least, let's not forget the atrocity that was the US's use of nuclear weapons on Japan. As if the internment of immigrants wasn't bad enough, the US murdered over 200,000 civilians in two detonations because the US demanded an unconditional surrender and refused to simply end the state of war without killing Japan's ruling class via show trial.",<praw.models.comment_forest.CommentForest object at 0x00000177116BE7B8>
143,rba8pi,"Men/women who complain about feminism/the patriarchy (respectively) are equally participating in the very thing they complain about, often times",WaterDemonPhoenix,1638913142.0,19,0.65,14,"It's funny how the same woman who complains about 'the patriarchy' treating women like weak people also want 'patriarchal' behaviours. They want men to treat them to dinner. You can dress it up all you like as 'it's just being nice', but it's the patriarchy. Why can't you be nice for a change? 'Well he asked me out'. While I would agree, I would still politely insist that we go halfies. 

It's funny the same men that complain about feminism, equality or whatever and still complain about having to pay for a woman's dinner. If you want strict gender roles, then fine, that means all the bad, not just the good. 

I don't think we can have it both ways, either we eliminate all concept of gender, and just do things because it works, not because 'he's a man or she's a woman' but because it works.",<praw.models.comment_forest.CommentForest object at 0x00000177116C2F98>
