,id,title,author,created_utc,score,upvote_ratio,num_comments,selftext,comments
0,rsqyj7,"People raging against so called ‘cancel culture’ are only angry because they can’t get away with racist, sexist, homophobic or transphobic bigotry.",Arkady2009,1640946047.0,0,0.43,29,"So many ‘comedians’ have complained that they can’t ‘say anything these days’. This is bullshit. Your racist and sexist ‘jokes’ not being tolerated doesn’t mean you can’t ‘say anything’. It just means you can’t profit off bigotry.

Any comedian angry over cancel culture is only angry because they have to come up with new ideas to entertain their audiences. 
People are only angry over cancel culture because they can’t go and see their favourite comedian and laugh at good old racist, homophobic jokes. 

It is only bigotry which is being cancelled. If you’re offended by this, chances are you’re a bigot, too.",<praw.models.comment_forest.CommentForest object at 0x000001770A554470>
1,rsjrsg,Student debt forgiveness is a Racist policy that will only hurt minorities.,KindnessSuplexDaddy,1640919800.0,5,0.55,36,"Minorities will be left behind. Take Black Americans. They are per captia least likely to attend  or graduate college. That means a small percentage of a minority group graduate college.


Source: https://www.americanprogress.org/article/neglected-college-race-gap-racial-disparities-among-college-completers/

Student debt forgiveness will effect all the Minorities who DID NOT attend college. Everyone who has a college degree compared to a non college degree holder already has a life time earning advantage over the major of non college educated Minorities. White people graduate at the highest percentage and have the best lifetime earnings advantage.

https://edtrust.org/resource/graduation-rates-dont-tell-the-full-story-racial-gaps-in-college-success-are-larger-than-we-think/



Erasing that debt, is for all intents giving them on average 30k or +300.00 a month in income AND lifetime income. That sudden injection of income will allow college graduates to buy houses, invest into retirement and if done well, that 30k can be extrapolated into hundreds of thousands of dollars for retirement.

All those things, non college graduates, Minorities like Black and Mexican Americans will be behind by 30k or 300 a month. Up to 70%.

Those Minorities won't have the ability to accumulate intrest/invest money like that into retirement. 

Minorities who won't get anything will not have anything to pass on compared to those who got student loans forgiven.


Student loans will only hurt minorities in America. It will increase the wealth gap, quality of life and generational wealth between whites and minorities.  A massive wealth shift like never before in history of America. I checked. 

We should never support something that makes us rich at the cost of others.  

The answer to your financial problems does not come at the cost of future generations. 

https://www.jbhe.com/2020/11/the-nationwide-racial-gap-in-college-graduation-rates-4/",<praw.models.comment_forest.CommentForest object at 0x000001770A49FEF0>
2,rscfbb,A kick to the vulva hurts more than a nutshot. Let me tell you why,almightypushx,1640898936.0,0,0.48,16,"
I know I’m gonna get downvoted into oblivion here but please try to keep an open mind.

The vulva has around 15,000 nerves, 8000 of which are in the clitoris. The male groin has around 4,000 nerve endings. 

The vulva is basically an open wound that can’t move or retract so it takes the full impact of the kick/hit.

But the vulva is slightly harder to hit due to the fact that it’s flat and a bit smaller


https://www.steadyhealth.com/medical-answers/being-kicked-in-the-vulva-or-vagina-equivalent-to-a-male-kick-in-the-nuts

Edit: everyone who downvoted is a dumbass. The point of this is for unpopular opinions (which it clearly is) so it should be receiving upvotes.",<praw.models.comment_forest.CommentForest object at 0x000001770A4BF8D0>
3,rs7i17,"Despite my views against accepting refugees, i find it disgusting to refer to them as 'imports'",WaterDemonPhoenix,1640886328.0,7,0.59,35,"Fuck the government for giving money to foreign countries, for accepting more refugees because it puts a strain on our system. And yeah. Some refugees are not good people. I am worried about them. That said, and this will shock people because I'm often called a Nazi for my mistrust in the groups of migrants, because frankly, I don't trust the Canadian vetting system  however, there is just something extremely wrong in my eyes to see these migrants as not human and only 'imports' like some sort of products. Some might be monsters, but they are part of the human nature. Some humans are garbage. But I still see them as human..

You could argue I'm no better. That's fine. I don't claim to have a moral high ground. I just don't lime your view. And no one has to like mine 

Now that said its unpopular because people are either pro or anti refugees and those against have the view that they are imports",<praw.models.comment_forest.CommentForest object at 0x000001770A4A58D0>
4,rs6wbf,Most people's lives have not been affected by COVID and this whole thing will only end when people stop being so concerned about it,DeliciousCabbage22,1640884780.0,129,0.7,283,"People are being way too worried about it, most people who get it will be just fine, i honestly think this whole thing is going too far, it's been two years ffs, anyone who is worried can stay home or smthn, the media should stop talking about it all the time, if they don't it will never end, as a healthy 18 year old i am sure as hell not gonna change my life for something that is extremely unlikely to kill me, people might not like my opinion but i am not gonna change it, people were calling me ""sElFisH"" when i refused to do this whole quarantine thing last year, i am sorry but i am simply not gonna waste months of my life sitting in between four walls for something that is not a derious threat to me.",<praw.models.comment_forest.CommentForest object at 0x000001770A459E10>
5,rs4tay,Conservatives are unpopular on reddit because their opinions are only shared with senile boomers whose brain is addled by lead poisoning .,FDMGROUPORNAH,1640879360.0,8,0.55,37,"climate change is a hoax, to have or to have not is mostly ordained by merit - and thus just , the environment is not worth preserving , healthcare shouldn’t be a guarantee , or workers rights  are bad ,m.


The list is endless in what they support which to any one with a semblance of sense will find absurd  !

To those who are sadly though only conservative out of culture war bullshit , i ask that you are being mislead and taken as a fool by the powerful. 

To those who concede to the  conservative ethos of pure unbridled power to capital and business. You truly are a maker of your own bed - and thus you cannot complain for being scorned - you combine both hostile social conservatism with hostile economic doctrine .",<praw.models.comment_forest.CommentForest object at 0x000001770A6B2908>
6,rs2izz,Tool is a contender for most overrated metal band of all time,Dozinggreen66,1640873006.0,7,0.69,12,"Yes, they’re good at their instruments I’ll give em that, but they’re so boring. Complexity =/= good song. I like prog, and I don’t mind long songs, but the problem with tool is that their songs are super long but super e m p t y, especially on their last album. Who wants to hear and 8 minute song with 4 minutes of ambient guitar noise and nothing happening? Also, Maynard is not that good of a vocalist, nor does he have good stage presence (wearing a bra and body paint does NOT count as stage presence if all you do is stand there). Not to mention tool has one of the worst fanbases of all time. You know the type, the pseudo intellectual pretentious weed addict who listen to lateralus once and think they qualify for a phd. When a fan base is super pushy about something like it’s gods gift to earth and it ends up being mediocre it just makes me dislike it even more. “Bro tools genius they used the Fibonacci sequence to write a song.” Yeah, well the ramones only used 3 power chords and write infinitely better songs",<praw.models.comment_forest.CommentForest object at 0x000001770A39D240>
7,rrxovd,All the news and talk about Ghislane Maxwell has been a complete waste of public attention,Ridley_Rohan,1640856475.0,0,0.33,8,"With all that goes on in the world, all the death, destruction, suffering and poverty ....all the teen pregnancy, teen suicide, teen abortion, teen on teen shootings, teen STDs, teen sexting arrests, and ACTUAL teen rape in America, would anyone reasonable care about this Ghislane Maxwell business?  

The word for today boys and girls, is, Distracted.   Can you say DISTRACTED?",<praw.models.comment_forest.CommentForest object at 0x000001770A32CAC8>
8,rrtt25,FPS games are not fun. I cannot for the life of me play any of these games without constantly being frustrated because of the pure chaos that they are.,GarunixReborn,1640842711.0,9,0.67,16,"Tried posting this in r/unpopularopinion a while ago, got nuked with ""ur just bad"" type comments. Maybe here i'll get some more useful responses.

These types of games are so extremely fast paced that anyone new to them needs to go through absolute hell to even become decent at the game. Most of the time you can't even control how the game goes. Someone ends up behind you, shoots you, and by the time you react you're already dead. Not only that but hacking is rampant in these games. You barely even have a chance to do anything, think of strategies, or react to anything. I'm sorry but these games do not deserve to exist, they're not fun in the slightest since all you're doing is reacting to someone appearing in front of you, and having a seizure on your keyboard trying to aim and shoot while they're flying around like flies",<praw.models.comment_forest.CommentForest object at 0x000001770A3722E8>
9,rrn1kb,I have no sympathy for people who complain about bank overdraft fees.,Believer109,1640823055.0,27,0.66,67,"Managing a bank account and balancing a checkbook is the most basic of personal finance. It's absurd that anyone should overdraft their account. Even if it does happen once, the bank seems justified in charging you a fee for your carelessness. People who complain about it seem to have it happen every month multiple times. I can't even think why these people bother having a bank account.",<praw.models.comment_forest.CommentForest object at 0x000001770A28D978>
10,rrlvv5,Conservatives who tell people to major in STEM as a solution to the student loan debt crisis are out of touch with reality,,1640820003.0,2,0.53,26,[deleted],<praw.models.comment_forest.CommentForest object at 0x000001770A295668>
11,rrg71a,the star wars fandom is one of the most toxic fandoms of all time,herequeerandgreat,1640805644.0,1,0.53,6," let me preface this by saying that i like star wars alot. i like the original trilogy, the sequel trilogy, rogue one, and the Mandalorian. although i do consider myself more of a star trek fan then a star wars fan, i love star wars for it\`s creativity, cast of characters, interesting world building, and amazing music.

that being said, whenever i think of things that have super toxic fandoms, i instantly think of the star wars fandom. i think fandoms are a good thing(i\`m a part of a couple so it would be hypocritical of me to say that i don\`t like them lol). however, some things have really toxic fandoms and star wars has one of the most toxic fanbases if not THE most toxic(and i\`m in the my little pony fandom so i know what i\`m talking about).

firstly, the star wars fandom is extremely hard to please if not downright impossible to please. when the force awakens came out, it was criticized for being too much like a new hope. then, the last jedi(which is in the top 5 of my favorite star wars movies) came out and fans were criticizing it for being too different from the other movies. what? it seems like the only thing star wars fans can agree on is that the original trilogy is good and the Mandalorian is Steller television.

this wouldn\`t be such a huge problem if the fandom wasn\`t so mean towards outside opinions. if you dare to say that you liked the sequel trilogy, prepare to be on the receiving end of many insults questioning your taste in movies and even some personal attacks that are completely uncalled for. ditto if you dare to say anything bad about the prequels(which i guess we all like now).

lastly, the star wars fandom has been at the center of most fan entitlement in the past couple of years. when the fans get pissed at something star wars related, THEY FUCKING LOSE IT! some have even gone to the extent of sending threats to some of the people involved in star wars. dude! it\`s a movie! just give it a negative review on IMDB on move on with your life.

star wars is my go to example of something that i like but hate the fanbase of. i know that every fandom has some bad eggs. i also know that not all star wars fans are like that. one of my managers is an uber star wars fan(like, collecting toys from the 80s. that\`s the type of fan we\`re dealing with here) and he\`s one of the nicest people i know and is not at all a douche about contradictory opinions. however, it honestly seems like the star wars fandom is just full of bad eggs and it seems like the nice star wars fans who just want to enjoy something that they love have become the exception instead of the norm.

it\`s perfectly alright to be passionate about something(i have quite a few pieces of media that i passionately love myself) but just chill the hell out folks.",<praw.models.comment_forest.CommentForest object at 0x000001770A3A6DA0>
12,rrcw48,Miles morales should be the next Spider-Man trilogy after Tom’s one and they should stop rebooting Peter Parker’s Spider-Man for a while,CharacterEconomics73,1640797383.0,6,0.61,7,"I know this might be a bit unpopular considering Tom’s story hasn’t finished yet but even he has said himself that he doesn’t want to play Spider-Man in his 30s. But his second trilogy could be made since he still has not reached 30 yet. So around the time that Tom’s second trilogy comes to end, Sony or marvel should make a miles morales trilogy instead of rebooting Peter Parker’s Spider-Man. It should be time for something new instead of making the same interaction of the same character for decades.",<praw.models.comment_forest.CommentForest object at 0x000001770A717978>
13,rr0tum,[deleted by user],,1640757551.0,0,0.45,28,[removed],<praw.models.comment_forest.CommentForest object at 0x000001770A346A20>
14,rqz73x,Rule 4 Confirmation,,1640752341.0,0,0.48,797,[deleted],<praw.models.comment_forest.CommentForest object at 0x0000017709E51160>
15,rqoevf,"It is ironic that conservatives complain about colleges spending too much money on the ""college experience"" when most colleges that spend money on things like sports are in red states",Ambitious-Tea4092,1640722087.0,0,0.35,17,[removed],<praw.models.comment_forest.CommentForest object at 0x000001770A049EF0>
16,rqob00,I think Yahweh would praise intactivists(anti-circumcision) and circumsexuals(pro-circumcision) before praising anyone devotedly Jewish but doing a disservice to Jewish history by denying the Jewish origin and purpose of circumcision.,WhereIsHisRidgedBand,1640721794.0,6,0.64,49,"To elaborate, r/intactivists are activists who believe that circumcision causes damage to the sexual organ and renders it permanently inhibited in some way. NSFW r/circumsexual are self-proclaimed individuals with an ""erotic"" mind toward circumcision. NSFL [Some of them like the damages](https://www.reddit.com/r/GrossCutters/comments/nzc6nr/gross_cutter_feels_pleasure_when_boys_are/).

Both sides confirm the teachings of Jewish leaders about circumcision's origin and purpose:

>Contrary to the Greeks and Romans, who believed in keeping the glans covered to show sexual control, Philo argued that removing the foreskin was what allowed Jewish men even greater control over their sexual passions. But why circumcise only males? In a volume entitled Questions and Answers on Genesis, Philo’s answer is that

>‘‘the male has more pleasure in, and desire for, mating than does the female, and he is more ready for it. Therefore Herightly leaves out the female, and **suppresses the undue impulses of the male by the sign of circumcision. [So] it was proper that his pride should be checked by the sign of circumcision**.’’

>[Philo, Questions and Answers 3.47, 241–42.] https://archive.ph/FfkYQ#selection-1955.0-1975.15


>Part III, Chapter 49

>Similarly with regard to circumcision, one of the reasons for is activity be diminished and the organ be in as quiet a state as possible. It has been thought that circumcision perfects what is defective congenitally. This gave the possibility to everyone to raise an objection and to say: How can natural things be defective so that they need to be perfected from outside, all the more because we know how useful the foreskin is for that member? **In fact this commandment has not been prescribed with a view to perfecting what is defective congenitally, but to perfecting what is defective morally. The bodily pain caused to that member is the real purpose of circumcision.** None of the activities necessary for the preservation of the individual is harmed thereby, nor is procreation rendered impossible, but violent concupiscence and lust that goes beyond what is needed are diminished. **The fact that circumcision weakens the faculty of sexual excitement and sometimes perhaps diminishes the pleasure is indubitable. For if at birth this member has been made to bleed and has had its covering taken away from it, it must indubitably be weakened. The Sages, may their memory be blessed, have explicitly stated: It is hard for a woman with whom an uncircumcised man has had sexual intercourse to separate from him. In my opinion this is the strongest of the reasons for circumcision.**

>Moses Maimonides http://www.cirp.org/library/cultural/maimonides/

I'm guessing these two know a lot more about keeping up with true Jewish traditions than someone today who is Jewish and saying things about circumcision along the lines of:

>Circumcision is not comparable to FGM in any way shape or form. There is almost nothing done to the man's sexuality or his orgasms. Women lose everything. Men can still orgasm, and good ones.

Then that man has narrowly escaped what these two Jewish leaders wanted the circumcision done for and what these men got r/circumcisiongrief

>You may not like religion or hold it in high regard, but it is their right to do so and practice as they see fit, whether or not you approve. One of their practices, which to be clear, is NOT a human rights violation by any standard, is circumcision.

I know China gets a lot of flak for their binding feet, and European corsets were damaging women's organs, but at least both of them should be able to conclude in the future that what Philo and Moses are saying above are a human rights violation if conducted on days old infant human beings at the weakest and least mentally developed point of their lives.

So, I believe if Yahweh was real and wanted circumcision for the purpose laid out by these two famous followers of his and highly regarded leaders of Jewish teachings, then circumcised intactivists and circumsexuals will get to heaven before anyone devotedly Jewish but blaspheming his covenant's cost.",<praw.models.comment_forest.CommentForest object at 0x0000017709E30908>
17,rqku6s,Republicans and right wing conservatives are ironically less patriotic than democrats and leftists.,lazybear1718,1640712286.0,0,0.44,83,"I seen post and videos of them praising Russian and foreign military propaganda as based and then turn around and make jokes about the US is full of ""leftist snowflakes"" and ""weaklings"" as if america hasn't been involved in multiple these past few decades, it's so fucking hypocritical it's funny.",<praw.models.comment_forest.CommentForest object at 0x00000177061B37F0>
18,rqko32,It should be legal for poor people to steal from rich people and damage their property,occasionaldrinker,1640711819.0,0,0.27,34,It’s not fair their are millionaires in the world when so many work 40 hours a week for minimum wage. Poor people should be able to legally steal from the rich. They should be able to key and slash tires of Tesla’s and Range Rovers. They should be allowed to because the income disparity is so ridiculously unfair and one sided.,<praw.models.comment_forest.CommentForest object at 0x0000017709DFFC18>
19,rqhpcw,James Webb Telescope is Meh,madhura1599,1640703573.0,0,0.45,19,"Another expensive Telescope yeeted into space so that few scientist can see faraway stars and planets which humanity will never reach, I am not against Science or Space but we could have use those resources on better technology like space lasers or an Amazon distribution center in space. I have read that there are over 3000 single point for failures on the telescope and that's just during launch, over its life time, it may crash and burn or like its predecessor go out of focus, I personally believe we should have invested more either those cool Space X rockets or a galactic storage which isn't hard to maintain compared to a Telescope. Now that's its launch may it can take better photos of space events, not like that blurry overrated photo they clicked of that Black hole. Is it just me who thinks we aren't solving immediate real world space issues with our NASA budget ?",<praw.models.comment_forest.CommentForest object at 0x0000017704A5E5F8>
20,rq8587,It should not be creepy for an older adult to go to a college party,Ambitious-Tea4092,1640670187.0,0,0.32,19,[removed],<praw.models.comment_forest.CommentForest object at 0x000001770A206DD8>
21,rq2rxt,[deleted by user],,1640654298.0,4,0.63,5,[removed],<praw.models.comment_forest.CommentForest object at 0x0000017709EBB080>
22,rpz4q0,Right wing libertarianism makes the least sense,CheckYourCorners,1640644013.0,15,0.64,144,"Let me be clear, libertarianism and maximizing freedom are some of the most important goals to have. Right wing libertarianism does not accomplish either of these goals. 

It has a great concept of negative freedoms (lack of external restraint on one's actions) but completely ignored positive freedoms (the capacity to act on ones free will). Workers in a company town technically have the freedom to leave and make money elsewhere but lack the money and capacity to do so.

Capitalism left to it's own devices always degrades into monopoly. The easiest examples to point to are any industry that commands a natural monopoly, in which the cost of entry is so high competition is nonexistent. Water, electricity, internet, social media, and infrastructure in general are all monopolies that are near impossible to break. Neoliberals realized this quite early and created their philosophy. They believe free markets require a strong state to maintain and the spread of neoliberalism has been nearly unstoppable ever since.

Not to mention they can be extremely comedic in their attempts to create right wing libertarian societies. The various attempts to create seafaring utopias have all failed spectacularly. One had a large security force that enforced the rules of the shareholders. Another banned cooking in individual suites and required people to buy from the ships restaurant. 

Freedom was never the goal, anybody who believes in this ideology either wants to smoke weed and own guns (just switch to left wing libertarianism if you want that) or believes that they would become the defacto monarch of this theoretical society.",<praw.models.comment_forest.CommentForest object at 0x0000017702E73F28>
23,rpxia8,[deleted by user],,1640639682.0,12,0.57,26,[removed],<praw.models.comment_forest.CommentForest object at 0x000001777AF5BBA8>
24,rpu032,eternals really isn`t as bad as people say it is,herequeerandgreat,1640630198.0,5,0.61,10,"i saw eternals in theaters in november and, despite all the negative press surrounding it, i actually enjoyed it. 

i thought that it was an interesting story with compelling characters(sprite being my personal favorite), cool action, great world building, and great setup for future MCU movies. after watching the movie, i really didn\`t get the negative press behind it because it was easily my favorite MCU movie of the year before i saw spiderman no way home. 

now, i\`m not saying the movie is completely flawless. kit harrington and bill skarsgard\`s characters are extremely underutilized, the film does rely quite heavily on exposition, and the film just kinda...stops. however, the worst movie of 2021? my friend, have you not seen music, karen, or thunder force? 

i give the eternals a B+",<praw.models.comment_forest.CommentForest object at 0x0000017702FF4CC0>
25,rpnqng,Everyone who flies on an airplane should have to submit to a BMI test before boarding.,Believer109,1640612314.0,0,0.47,86,[removed],<praw.models.comment_forest.CommentForest object at 0x00000177045BC278>
